{
  "backend": "serial",
  "environment": {
    "baudrate": 1000000,
    "device": "/dev/ttyACM0",
    "frequency_hz": 50.0,
    "hardware_authorized": true,
    "platform": "Linux-6.1.83-aarch64-with-glibc2.35",
    "python": "3.10.12",
    "suspended_or_benched": true,
    "telemetry_records_dropped": 0,
    "timeout_ms": 4.0,
    "torque_enabled": false,
    "torque_off_status": "ok",
    "watchdog_consecutive_failures": 2
  },
  "gates": {
    "authorization_provenance": true,
    "complete_record_stream": true,
    "gate1_candidate": true,
    "ping_ok": true,
    "torque_off_confirmed": true,
    "zero_read_bursts": true,
    "zero_transaction_failures": true,
    "zero_unexpected_response_lengths": true
  },
  "halt_reason": null,
  "hardware_gate_status": "REVIEW_REQUIRED",
  "informational_only": false,
  "jsonl_sha256": "b5941cd085c179581b3486a25829ce62f8331ae418d970280430d7ff89b773d6",
  "max_read_burst_ticks": 0,
  "ping_status": "ok",
  "read_burst_count": 0,
  "review_status": "REVIEW_REQUIRED",
  "round_trip_ms": {
    "max": 3.215767,
    "mean": 0.820043858,
    "min": 0.378543,
    "p95": 0.9130216499999999,
    "p99": 0.95967141,
    "p99_9": 1.0165087500000092
  },
  "run_status": "COMPLETE",
  "schema_version": "open_duck_x5.single_servo_summary.v1",
  "servo_id": 13,
  "tick_period_ms": {
    "max": 20.131985,
    "mean": 20.000023881440722,
    "min": 19.88703,
    "p95": 20.0549943,
    "p99": 20.08111762,
    "p99_9": 20.091162316000002
  },
  "ticks": 2000,
  "ticks_requested": 2000,
  "transaction_failure_rate": 0.0,
  "transaction_status_counts": {
    "crc": 0,
    "device": 0,
    "io": 0,
    "ok": 2000,
    "partial": 0,
    "timeout": 0,
    "unexpected_id": 0
  },
  "transactions_failed": 0,
  "unexpected_response_length_count": 0
}
